{
  "schema_version": 2,
  "run": {
    "run_id": "60fd9df6-c258-4a72-b512-d49f6e9dee31",
    "generated_at": "2026-08-10T09:59:10.168621+00:00",
    "collection": "badgr_natural_flow_v1",
    "collection_count": 96,
    "version": "0.4.0-dev.12",
    "embedding_model": "nomic-embed-text",
    "embedding_dimension": 768
  },
  "summary": {
    "generated": "2026-08-10T09:59:10.168621+00:00",
    "collection": "badgr_natural_flow_v1",
    "collection_count": 96,
    "embedding_model": "nomic-embed-text",
    "dimension": 768,
    "k": 5,
    "retrieval_cases": 17,
    "useful_hits": 17,
    "useful_hit_rate": 1.0,
    "exact_term_pass": true,
    "positive_source_ratio": 0.753,
    "negative_contamination": 0,
    "citation_failures": 0,
    "lexical_degraded": false,
    "latency_ms_p50": 74,
    "latency_ms_p95": 87,
    "distance_min": 0.1439,
    "distance_max": 0.463614,
    "distance_median": 0.33595,
    "similarity_min": 0.536386,
    "similarity_max": 0.8561,
    "assertion_failures": 0,
    "failed_assertions": [],
    "evaluation_case_chunks_returned": 0,
    "preservation_correct": 10,
    "preservation_total": 10,
    "configured_similarity_floor": null
  },
  "cases": [
    {
      "id": "EVAL-001",
      "query_id": "EVAL-001",
      "query_sha256": "47c8a5f96c446e439fd5b9708ae2bcc405194ba69db9230fdd9b2570400bc66e",
      "mode": "retrieval",
      "latency_ms": 107,
      "ranked": 5,
      "neighbours": 7,
      "dense_n": 24,
      "lexical_n": 24,
      "lexical_error": null,
      "useful_hit": true,
      "matched_marker": "Pair CW-001",
      "doc_types": [
        "approved_example",
        "approved_example",
        "approved_example",
        "glossary",
        "approved_example"
      ],
      "positive_chunks": 4,
      "negative_chunks": 0,
      "contamination": 0,
      "bad_citations": [],
      "top_headings": [
        "Pair CW-001 \u2014 Technical security explainer",
        "SCR-002 \u2014 Technical security explanation (matche",
        "Pair CW-022 \u2014 Technical: permission boundary",
        "Authoritative working vocabulary for voice direc",
        "Pair CW-018 \u2014 Technical: retry and backoff behav"
      ],
      "min_distance": 0.159409,
      "max_distance": 0.389193,
      "results": [
        {
          "query_id": "EVAL-001",
          "chunk_id": "ff22742d0e268090_2",
          "source_id": "owner_examples",
          "doc_type": "approved_example",
          "heading": "Pair CW-001 \u2014 Technical security explainer",
          "is_neighbor": false,
          "dense": {
            "present": true,
            "rank": 1,
            "distance": 0.15940916538238525,
            "metric": "cosine_distance",
            "direction": "lower_is_better"
          },
          "bm25": {
            "present": true,
            "rank": 1,
            "score": 184.65853681064078,
            "direction": "higher_is_better"
          },
          "fused": {
            "present": true,
            "rank": 1,
            "score": 0.03278688524590164,
            "method": "reciprocal_rank_fusion",
            "rrf_k": 60
          }
        },
        {
          "query_id": "EVAL-001",
          "chunk_id": "8ae750a3d5103fce_2",
          "source_id": "owner_examples",
          "doc_type": "approved_example",
          "heading": "SCR-002 \u2014 Technical security explanation (matches POS-002 Jessica, POS-003 Se\u00e1n)",
          "is_neighbor": false,
          "dense": {
            "present": true,
            "rank": 2,
            "distance": 0.17868316173553467,
            "metric": "cosine_distance",
            "direction": "lower_is_better"
          },
          "bm25": {
            "present": true,
            "rank": 2,
            "score": 162.3135514919578,
            "direction": "higher_is_better"
          },
          "fused": {
            "present": true,
            "rank": 2,
            "score": 0.03225806451612903,
            "method": "reciprocal_rank_fusion",
            "rrf_k": 60
          }
        },
        {
          "query_id": "EVAL-001",
          "chunk_id": "37764f3444fdb24e_12",
          "source_id": "owner_examples",
          "doc_type": "approved_example",
          "heading": "Pair CW-022 \u2014 Technical: permission boundary",
          "is_neighbor": false,
          "dense": {
            "present": true,
            "rank": 3,
            "distance": 0.3033088445663452,
            "metric": "cosine_distance",
            "direction": "lower_is_better"
          },
          "bm25": {
            "present": true,
            "rank": 8,
            "score": 34.72429200060935,
            "direction": "higher_is_better"
          },
          "fused": {
            "present": true,
            "rank": 3,
            "score": 0.03057889822595705,
            "method": "reciprocal_rank_fusion",
            "rrf_k": 60
          }
        },
        {
          "query_id": "EVAL-001",
          "chunk_id": "8cbaa18ddaa43a90_1",
          "source_id": "cwalts_prosody_glossary",
          "doc_type": "glossary",
          "heading": "Authoritative working vocabulary for voice direction",
          "is_neighbor": false,
          "dense": {
            "present": true,
            "rank": 6,
            "distance": 0.38929593563079834,
            "metric": "cosine_distance",
            "direction": "lower_is_better"
          },
          "bm25": {
            "present": true,
            "rank": 5,
            "score": 37.35681696555947,
            "direction": "higher_is_better"
          },
          "fused": {
            "present": true,
            "rank": 4,
            "score": 0.030536130536130537,
            "method": "reciprocal_rank_fusion",
            "rrf_k": 60
          }
        },
        {
          "query_id": "EVAL-001",
          "chunk_id": "54a0ff167fcd24a8_7",
          "source_id": "owner_examples",
          "doc_type": "approved_example",
          "heading": "Pair CW-018 \u2014 Technical: retry and backoff behaviour",
          "is_neighbor": false,
          "dense": {
            "present": true,
            "rank": 18,
            "distance": 0.4233611822128296,
            "metric": "cosine_distance",
            "direction": "lower_is_better"
          },
          "bm25": {
            "present": true,
            "rank": 3,
            "score": 43.077657405796735,
            "direction": "higher_is_better"
          },
          "fused": {
            "present": true,
            "rank": 5,
            "score": 0.028693528693528692,
            "method": "reciprocal_rank_fusion",
            "rrf_k": 60
          }
        },
        {
          "query_id": "EVAL-001",
          "chunk_id": "eb95f427e277854c_1",
          "source_id": "owner_examples",
          "doc_type": "approved_example",
          "heading": "Market-facing natural-language and voice-delivery examples",
          "is_neighbor": true,
          "dense": {
            "present": false,
            "rank": null,
            "distance": null,
            "metric": "cosine_distance",
            "direction": "lower_is_better"
          },
          "bm25": {
            "present": false,
            "rank": null,
            "score": null,
            "direction": "higher_is_better"
          },
          "fused": {
            "present": false,
            "rank": null,
            "score": null,
            "method": null,
            "rrf_k": null
          }
        },
        {
          "query_id": "EVAL-001",
          "chunk_id": "bce02a3432730d81_3",
          "source_id": "owner_examples",
          "doc_type": "approved_example",
          "heading": "Pair CW-001 \u2014 Technical security explainer",
          "is_neighbor": true,
          "dense": {
            "present": false,
            "rank": null,
            "distance": null,
            "metric": "cosine_distance",
            "direction": "lower_is_better"
          },
          "bm25": {
            "present": false,
            "rank": null,
            "score": null,
            "direction": "higher_is_better"
          },
          "fused": {
            "present": false,
            "rank": null,
            "score": null,
            "method": null,
            "rrf_k": null
          }
        },
        {
          "query_id": "EVAL-001",
          "chunk_id": "d641f61d77da221c_1",
          "source_id": "owner_examples",
          "doc_type": "approved_example",
          "heading": "SCR-001 \u2014 Professional introduction (matches POS-004, B. Lawson)",
          "is_neighbor": true,
          "dense": {
            "present": false,
            "rank": null,
            "distance": null,
            "metric": "cosine_distance",
            "direction": "lower_is_better"
          },
          "bm25": {
            "present": false,
            "rank": null,
            "score": null,
            "direction": "higher_is_better"
          },
          "fused": {
            "present": false,
            "rank": null,
            "score": null,
            "method": null,
            "rrf_k": null
          }
        },
        {
          "query_id": "EVAL-001",
          "chunk_id": "3b18a6b3904ab228_3",
          "source_id": "owner_examples",
          "doc_type": "approved_example",
          "heading": "SCR-002 \u2014 Technical security explanation (matches POS-002 Jessica, POS-003 Se\u00e1n)",
          "is_neighbor": true,
          "dense": {
            "present": false,
            "rank": null,
            "distance": null,
            "metric": "cosine_distance",
            "direction": "lower_is_better"
          },
          "bm25": {
            "present": false,
            "rank": null,
            "score": null,
            "direction": "higher_is_better"
          },
          "fused": {
            "present": false,
            "rank": null,
            "score": null,
            "method": null,